Frame 336: 622 bytes on wire (4976 bits), 622 bytes captured (4976 bits) on interface 0
    Interface id: 0
    Encapsulation type: Ethernet (1)
    Arrival Time: May  2, 2017 17:01:39.591509064 EDT
    [Time shift for this packet: 0.000000000 seconds]
    Epoch Time: 1493758899.591509064 seconds
    [Time delta from previous captured frame: 0.021058987 seconds]
    [Time delta from previous displayed frame: 0.000000000 seconds]
    [Time since reference or first frame: 2.412854760 seconds]
    Frame Number: 336
    Frame Length: 622 bytes (4976 bits)
    Capture Length: 622 bytes (4976 bits)
    [Frame is marked: False]
    [Frame is ignored: False]
    [Protocols in frame: eth:ip:tcp:sip]
Ethernet II, Src: c8:1f:66:ea:a9:6c (c8:1f:66:ea:a9:6c), Dst: a8:9d:21:92:e2:1b (a8:9d:21:92:e2:1b)
    Destination: a8:9d:21:92:e2:1b (a8:9d:21:92:e2:1b)
        Address: a8:9d:21:92:e2:1b (a8:9d:21:92:e2:1b)
        .... ..0. .... .... .... .... = LG bit: Globally unique address (factory default)
        .... ...0 .... .... .... .... = IG bit: Individual address (unicast)
    Source: c8:1f:66:ea:a9:6c (c8:1f:66:ea:a9:6c)
        Address: c8:1f:66:ea:a9:6c (c8:1f:66:ea:a9:6c)
        .... ..0. .... .... .... .... = LG bit: Globally unique address (factory default)
        .... ...0 .... .... .... .... = IG bit: Individual address (unicast)
    Type: IP (0x0800)
Internet Protocol Version 4, Src: 192.168.25.2 (192.168.25.2), Dst: 52.50.205.41 (52.50.205.41)
    Version: 4
    Header length: 20 bytes
    Differentiated Services Field: 0x00 (DSCP 0x00: Default; ECN: 0x00: Not-ECT (Not ECN-Capable Transport))
        0000 00.. = Differentiated Services Codepoint: Default (0x00)
        .... ..00 = Explicit Congestion Notification: Not-ECT (Not ECN-Capable Transport) (0x00)
    Total Length: 608
    Identification: 0x1406 (5126)
    Flags: 0x02 (Don't Fragment)
        0... .... = Reserved bit: Not set
        .1.. .... = Don't fragment: Set
        ..0. .... = More fragments: Not set
    Fragment offset: 0
    Time to live: 64
    Protocol: TCP (6)
    Header checksum: 0x498c [validation disabled]
        [Good: False]
        [Bad: False]
    Source: 192.168.25.2 (192.168.25.2)
    Destination: 52.50.205.41 (52.50.205.41)
Transmission Control Protocol, Src Port: 45977 (45977), Dst Port: 5060 (5060), Seq: 1, Ack: 1, Len: 556
    Source port: 45977 (45977)
    Destination port: 5060 (5060)
    [Stream index: 48]
    Sequence number: 1    (relative sequence number)
    [Next sequence number: 557    (relative sequence number)]
    Acknowledgment number: 1    (relative ack number)
    Header length: 32 bytes
    Flags: 0x018 (PSH, ACK)
        000. .... .... = Reserved: Not set
        ...0 .... .... = Nonce: Not set
        .... 0... .... = Congestion Window Reduced (CWR): Not set
        .... .0.. .... = ECN-Echo: Not set
        .... ..0. .... = Urgent: Not set
        .... ...1 .... = Acknowledgment: Set
        .... .... 1... = Push: Set
        .... .... .0.. = Reset: Not set
        .... .... ..0. = Syn: Not set
        .... .... ...0 = Fin: Not set
    Window size value: 148
    [Calculated window size: 148]
    [Window size scaling factor: -1 (unknown)]
    Checksum: 0xdd58 [validation disabled]
        [Good Checksum: False]
        [Bad Checksum: False]
    Options: (12 bytes), No-Operation (NOP), No-Operation (NOP), Timestamps
        No-Operation (NOP)
            Type: 1
                0... .... = Copy on fragmentation: No
                .00. .... = Class: Control (0)
                ...0 0001 = Number: No-Operation (NOP) (1)
        No-Operation (NOP)
            Type: 1
                0... .... = Copy on fragmentation: No
                .00. .... = Class: Control (0)
                ...0 0001 = Number: No-Operation (NOP) (1)
        Timestamps: TSval 1530704060, TSecr 284593559
            Kind: Timestamp (8)
            Length: 10
            Timestamp value: 1530704060
            Timestamp echo reply: 284593559
    [SEQ/ACK analysis]
        [Bytes in flight: 556]
Session Initiation Protocol (OPTIONS)
    Request-Line: OPTIONS sip:52.50.205.41 SIP/2.0
        Method: OPTIONS
        Request-URI: sip:52.50.205.41
            Request-URI Host Part: 52.50.205.41
        [Resent Packet: False]
    Message Header
        Via: SIP/2.0/TCP 37.76.239.43:5060;branch=z9hG4bK108e9682
            Transport: TCP
            Sent-by Address: 37.76.239.43
            Sent-by port: 5060
            Branch: z9hG4bK108e9682
        Max-Forwards: 70
        From: "asterisk" <sip:asterisk@37.76.239.43>;tag=as6dcbefdd
            SIP Display info: "asterisk"
            SIP from address: sip:asterisk@37.76.239.43
                SIP from address User Part: asterisk
                SIP from address Host Part: 37.76.239.43
            SIP from tag: as6dcbefdd
        To: <sip:52.50.205.41>
            SIP to address: sip:52.50.205.41
                SIP to address Host Part: 52.50.205.41
        Contact: <sip:asterisk@37.76.239.43:5060;transport=TCP>
            Contact URI: sip:asterisk@37.76.239.43:5060;transport=TCP
                Contact URI User Part: asterisk
                Contact URI Host Part: 37.76.239.43
                Contact URI Host Port: 5060
                Contact URI parameter: transport=TCP
        Call-ID: 55eff2d53979587968ae39ae48d57847@37.76.239.43:5060
        CSeq: 102 OPTIONS
            Sequence Number: 102
            Method: OPTIONS
        User-Agent: Asterisk PBX GIT-master-95cf4f8
        Date: Tue, 02 May 2017 21:01:39 GMT
        Allow: INVITE, ACK, CANCEL, OPTIONS, BYE, REFER, SUBSCRIBE, NOTIFY, INFO, PUBLISH, MESSAGE
        Supported: replaces, timer
        Content-Length: 0

Frame 343: 444 bytes on wire (3552 bits), 444 bytes captured (3552 bits) on interface 0
    Interface id: 0
    Encapsulation type: Ethernet (1)
    Arrival Time: May  2, 2017 17:01:39.694986947 EDT
    [Time shift for this packet: 0.000000000 seconds]
    Epoch Time: 1493758899.694986947 seconds
    [Time delta from previous captured frame: 0.020431506 seconds]
    [Time delta from previous displayed frame: 0.103477883 seconds]
    [Time since reference or first frame: 2.516332643 seconds]
    Frame Number: 343
    Frame Length: 444 bytes (3552 bits)
    Capture Length: 444 bytes (3552 bits)
    [Frame is marked: False]
    [Frame is ignored: False]
    [Protocols in frame: eth:ip:tcp:sip]
Ethernet II, Src: a8:9d:21:92:e2:1b (a8:9d:21:92:e2:1b), Dst: c8:1f:66:ea:a9:6c (c8:1f:66:ea:a9:6c)
    Destination: c8:1f:66:ea:a9:6c (c8:1f:66:ea:a9:6c)
        Address: c8:1f:66:ea:a9:6c (c8:1f:66:ea:a9:6c)
        .... ..0. .... .... .... .... = LG bit: Globally unique address (factory default)
        .... ...0 .... .... .... .... = IG bit: Individual address (unicast)
    Source: a8:9d:21:92:e2:1b (a8:9d:21:92:e2:1b)
        Address: a8:9d:21:92:e2:1b (a8:9d:21:92:e2:1b)
        .... ..0. .... .... .... .... = LG bit: Globally unique address (factory default)
        .... ...0 .... .... .... .... = IG bit: Individual address (unicast)
    Type: IP (0x0800)
Internet Protocol Version 4, Src: 52.50.205.41 (52.50.205.41), Dst: 192.168.25.2 (192.168.25.2)
    Version: 4
    Header length: 20 bytes
    Differentiated Services Field: 0x00 (DSCP 0x00: Default; ECN: 0x00: Not-ECT (Not ECN-Capable Transport))
        0000 00.. = Differentiated Services Codepoint: Default (0x00)
        .... ..00 = Explicit Congestion Notification: Not-ECT (Not ECN-Capable Transport) (0x00)
    Total Length: 430
    Identification: 0x50fa (20730)
    Flags: 0x02 (Don't Fragment)
        0... .... = Reserved bit: Not set
        .1.. .... = Don't fragment: Set
        ..0. .... = More fragments: Not set
    Fragment offset: 0
    Time to live: 43
    Protocol: TCP (6)
    Header checksum: 0x224a [validation disabled]
        [Good: False]
        [Bad: False]
    Source: 52.50.205.41 (52.50.205.41)
    Destination: 192.168.25.2 (192.168.25.2)
Transmission Control Protocol, Src Port: 5060 (5060), Dst Port: 45977 (45977), Seq: 1, Ack: 557, Len: 378
    Source port: 5060 (5060)
    Destination port: 45977 (45977)
    [Stream index: 48]
    Sequence number: 1    (relative sequence number)
    [Next sequence number: 379    (relative sequence number)]
    Acknowledgment number: 557    (relative ack number)
    Header length: 32 bytes
    Flags: 0x018 (PSH, ACK)
        000. .... .... = Reserved: Not set
        ...0 .... .... = Nonce: Not set
        .... 0... .... = Congestion Window Reduced (CWR): Not set
        .... .0.. .... = ECN-Echo: Not set
        .... ..0. .... = Urgent: Not set
        .... ...1 .... = Acknowledgment: Set
        .... .... 1... = Push: Set
        .... .... .0.. = Reset: Not set
        .... .... ..0. = Syn: Not set
        .... .... ...0 = Fin: Not set
    Window size value: 254
    [Calculated window size: 254]
    [Window size scaling factor: -1 (unknown)]
    Checksum: 0x8eef [validation disabled]
        [Good Checksum: False]
        [Bad Checksum: False]
    Options: (12 bytes), No-Operation (NOP), No-Operation (NOP), Timestamps
        No-Operation (NOP)
            Type: 1
                0... .... = Copy on fragmentation: No
                .00. .... = Class: Control (0)
                ...0 0001 = Number: No-Operation (NOP) (1)
        No-Operation (NOP)
            Type: 1
                0... .... = Copy on fragmentation: No
                .00. .... = Class: Control (0)
                ...0 0001 = Number: No-Operation (NOP) (1)
        Timestamps: TSval 284608585, TSecr 1530704060
            Kind: Timestamp (8)
            Length: 10
            Timestamp value: 284608585
            Timestamp echo reply: 1530704060
    [SEQ/ACK analysis]
        [This is an ACK to the segment in frame: 336]
        [The RTT to ACK the segment was: 0.103477883 seconds]
        [Bytes in flight: 378]
Session Initiation Protocol (200)
    Status-Line: SIP/2.0 200 OK
        Status-Code: 200
        [Resent Packet: False]
    Message Header
        Via: SIP/2.0/TCP 37.76.239.43:5060;branch=z9hG4bK108e9682
            Transport: TCP
            Sent-by Address: 37.76.239.43
            Sent-by port: 5060
            Branch: z9hG4bK108e9682
        From: "asterisk" <sip:asterisk@37.76.239.43>;tag=as6dcbefdd
            SIP Display info: "asterisk"
            SIP from address: sip:asterisk@37.76.239.43
                SIP from address User Part: asterisk
                SIP from address Host Part: 37.76.239.43
            SIP from tag: as6dcbefdd
        To: <sip:52.50.205.41>;tag=978d496df1a1a660cc0e6a53bff56662.3d8f
            SIP to address: sip:52.50.205.41
                SIP to address Host Part: 52.50.205.41
            SIP to tag: 978d496df1a1a660cc0e6a53bff56662.3d8f
        Call-ID: 55eff2d53979587968ae39ae48d57847@37.76.239.43:5060
        CSeq: 102 OPTIONS
            Sequence Number: 102
            Method: OPTIONS
        Accept: */*
        Accept-Language: en
        Server: OpenSIPS (2.1.5 (x86_64/linux))
        Content-Length: 0

Frame 1940: 1032 bytes on wire (8256 bits), 1032 bytes captured (8256 bits) on interface 0
    Interface id: 0
    Encapsulation type: Ethernet (1)
    Arrival Time: May  2, 2017 17:01:57.403102907 EDT
    [Time shift for this packet: 0.000000000 seconds]
    Epoch Time: 1493758917.403102907 seconds
    [Time delta from previous captured frame: 0.056481506 seconds]
    [Time delta from previous displayed frame: 17.708115960 seconds]
    [Time since reference or first frame: 20.224448603 seconds]
    Frame Number: 1940
    Frame Length: 1032 bytes (8256 bits)
    Capture Length: 1032 bytes (8256 bits)
    [Frame is marked: False]
    [Frame is ignored: False]
    [Protocols in frame: eth:ip:udp:sip:sdp]
Ethernet II, Src: a8:9d:21:92:e2:1b (a8:9d:21:92:e2:1b), Dst: c8:1f:66:ea:a9:6c (c8:1f:66:ea:a9:6c)
    Destination: c8:1f:66:ea:a9:6c (c8:1f:66:ea:a9:6c)
        Address: c8:1f:66:ea:a9:6c (c8:1f:66:ea:a9:6c)
        .... ..0. .... .... .... .... = LG bit: Globally unique address (factory default)
        .... ...0 .... .... .... .... = IG bit: Individual address (unicast)
    Source: a8:9d:21:92:e2:1b (a8:9d:21:92:e2:1b)
        Address: a8:9d:21:92:e2:1b (a8:9d:21:92:e2:1b)
        .... ..0. .... .... .... .... = LG bit: Globally unique address (factory default)
        .... ...0 .... .... .... .... = IG bit: Individual address (unicast)
    Type: IP (0x0800)
Internet Protocol Version 4, Src: 52.50.205.41 (52.50.205.41), Dst: 192.168.25.2 (192.168.25.2)
    Version: 4
    Header length: 20 bytes
    Differentiated Services Field: 0x00 (DSCP 0x00: Default; ECN: 0x00: Not-ECT (Not ECN-Capable Transport))
        0000 00.. = Differentiated Services Codepoint: Default (0x00)
        .... ..00 = Explicit Congestion Notification: Not-ECT (Not ECN-Capable Transport) (0x00)
    Total Length: 1018
    Identification: 0xacca (44234)
    Flags: 0x02 (Don't Fragment)
        0... .... = Reserved bit: Not set
        .1.. .... = Don't fragment: Set
        ..0. .... = More fragments: Not set
    Fragment offset: 0
    Time to live: 43
    Protocol: UDP (17)
    Header checksum: 0xc422 [validation disabled]
        [Good: False]
        [Bad: False]
    Source: 52.50.205.41 (52.50.205.41)
    Destination: 192.168.25.2 (192.168.25.2)
User Datagram Protocol, Src Port: 5060 (5060), Dst Port: 5060 (5060)
    Source port: 5060 (5060)
    Destination port: 5060 (5060)
    Length: 998
    Checksum: 0x37d7 [validation disabled]
        [Good Checksum: False]
        [Bad Checksum: False]
Session Initiation Protocol (INVITE)
    Request-Line: INVITE sip:+201006683021@37.76.239.43;user=phone SIP/2.0
        Method: INVITE
        Request-URI: sip:+201006683021@37.76.239.43;user=phone
            Request-URI User Part: +201006683021
            Request-URI Host Part: 37.76.239.43
        [Resent Packet: False]
    Message Header
        FROM: "Ahmed Shabrawy"<sip:1100@cequens.com;user=phone>;epid=5945353D84;tag=c0f7409094
            SIP Display info: "Ahmed Shabrawy"
            SIP from address: sip:1100@cequens.com;user=phone
                SIP from address User Part: 1100
                SIP from address Host Part: cequens.com
                SIP From URI parameter: user=phone
            SIP from tag: c0f7409094
        TO: <sip:201006683021@sip.cequens.net;user=phone>
            SIP to address: sip:201006683021@sip.cequens.net;user=phone
                SIP to address User Part: 201006683021
                SIP to address Host Part: sip.cequens.net
                SIP To URI parameter: user=phone
        CSEQ: 28537 INVITE
            Sequence Number: 28537
            Method: INVITE
        CALL-ID: 4df62d77-f7b2-4377-a8b6-abe614ab9c0f
        Max-Forwards: 69
        Via: SIP/2.0/UDP 52.50.205.41:5060;branch=z9hG4bK6a8f.e00550c7.0;i=9
            Transport: UDP
            Sent-by Address: 52.50.205.41
            Sent-by port: 5060
            Branch: z9hG4bK6a8f.e00550c7.0
            i=9
        CONTACT: <sip:52.50.205.41;did=89.63ab84f>
            Contact URI: sip:52.50.205.41;did=89.63ab84f
                Contact URI Host Part: 52.50.205.41
                Contact URI parameter: did=89.63ab84f
        CONTENT-LENGTH: 337
        SUPPORTED: 100rel
        USER-AGENT: RTCC/5.0.0.0 MediationServer
        CONTENT-TYPE: application/sdp
        ALLOW: ACK
        P-ASSERTED-IDENTITY: "Ahmed Shabrawy"<sip:a.shabrawy@cequens.com>,<tel:1100>
            SIP Display info: "Ahmed Shabrawy"
            SIP PAI Address: sip:a.shabrawy@cequens.com
                SIP PAI User Part: a.shabrawy
                SIP PAI Host Part: cequens.com
        Privacy: id
        Allow: CANCEL,BYE,INVITE,PRACK,UPDATE
    Message Body
        Session Description Protocol
            Session Description Protocol Version (v): 0
            Owner/Creator, Session Id (o): - 128 1 IN IP4 192.168.7.5
                Owner Username: -
                Session ID: 128
                Session Version: 1
                Owner Network Type: IN
                Owner Address Type: IP4
                Owner Address: 192.168.7.5
            Session Name (s): session
            Connection Information (c): IN IP4 192.168.7.5
                Connection Network Type: IN
                Connection Address Type: IP4
                Connection Address: 192.168.7.5
            Bandwidth Information (b): CT:1000
                Bandwidth Modifier: CT [Conference Total(total bandwidth of all RTP sessions)]
                Bandwidth Value: 1000 kb/s
            Time Description, active time (t): 0 0
                Session Start Time: 0
                Session Stop Time: 0
            Media Description, name and address (m): audio 50586 RTP/AVP 97 101 13 0 8
                Media Type: audio
                Media Port: 50586
                Media Protocol: RTP/AVP
                Media Format: DynamicRTP-Type-97
                Media Format: DynamicRTP-Type-101
                Media Format: Comfort noise
                Media Format: ITU-T G.711 PCMU
                Media Format: ITU-T G.711 PCMA
            Connection Information (c): IN IP4 192.168.7.5
                Connection Network Type: IN
                Connection Address Type: IP4
                Connection Address: 192.168.7.5
            Media Attribute (a): rtcp:50587
                Media Attribute Fieldname: rtcp
                Media Attribute Value: 50587
            Media Attribute (a): label:Audio
                Media Attribute Fieldname: label
                Media Attribute Value: Audio
            Media Attribute (a): sendrecv
            Media Attribute (a): rtpmap:97 RED/8000
                Media Attribute Fieldname: rtpmap
                Media Format: 97
                MIME Type: RED
                Sample Rate: 8000
            Media Attribute (a): rtpmap:101 telephone-event/8000
                Media Attribute Fieldname: rtpmap
                Media Format: 101
                MIME Type: telephone-event
                Sample Rate: 8000
            Media Attribute (a): fmtp:101 0-16
                Media Attribute Fieldname: fmtp
                Media Format: 101 [telephone-event]
                Media format specific parameters: 0-16
            Media Attribute (a): rtpmap:13 CN/8000
                Media Attribute Fieldname: rtpmap
                Media Format: 13
                MIME Type: CN
                Sample Rate: 8000
            Media Attribute (a): rtpmap:0 PCMU/8000
                Media Attribute Fieldname: rtpmap
                Media Format: 0
                MIME Type: PCMU
                Sample Rate: 8000
            Media Attribute (a): rtpmap:8 PCMA/8000
                Media Attribute Fieldname: rtpmap
                Media Format: 8
                MIME Type: PCMA
                Sample Rate: 8000
            Media Attribute (a): ptime:20
                Media Attribute Fieldname: ptime
                Media Attribute Value: 20

Frame 1946: 590 bytes on wire (4720 bits), 590 bytes captured (4720 bits) on interface 0
    Interface id: 0
    Encapsulation type: Ethernet (1)
    Arrival Time: May  2, 2017 17:01:57.404939035 EDT
    [Time shift for this packet: 0.000000000 seconds]
    Epoch Time: 1493758917.404939035 seconds
    [Time delta from previous captured frame: 0.000280094 seconds]
    [Time delta from previous displayed frame: 0.001836128 seconds]
    [Time since reference or first frame: 20.226284731 seconds]
    Frame Number: 1946
    Frame Length: 590 bytes (4720 bits)
    Capture Length: 590 bytes (4720 bits)
    [Frame is marked: False]
    [Frame is ignored: False]
    [Protocols in frame: eth:ip:udp:sip]
Ethernet II, Src: c8:1f:66:ea:a9:6c (c8:1f:66:ea:a9:6c), Dst: a8:9d:21:92:e2:1b (a8:9d:21:92:e2:1b)
    Destination: a8:9d:21:92:e2:1b (a8:9d:21:92:e2:1b)
        Address: a8:9d:21:92:e2:1b (a8:9d:21:92:e2:1b)
        .... ..0. .... .... .... .... = LG bit: Globally unique address (factory default)
        .... ...0 .... .... .... .... = IG bit: Individual address (unicast)
    Source: c8:1f:66:ea:a9:6c (c8:1f:66:ea:a9:6c)
        Address: c8:1f:66:ea:a9:6c (c8:1f:66:ea:a9:6c)
        .... ..0. .... .... .... .... = LG bit: Globally unique address (factory default)
        .... ...0 .... .... .... .... = IG bit: Individual address (unicast)
    Type: IP (0x0800)
Internet Protocol Version 4, Src: 192.168.25.2 (192.168.25.2), Dst: 52.50.205.41 (52.50.205.41)
    Version: 4
    Header length: 20 bytes
    Differentiated Services Field: 0x00 (DSCP 0x00: Default; ECN: 0x00: Not-ECT (Not ECN-Capable Transport))
        0000 00.. = Differentiated Services Codepoint: Default (0x00)
        .... ..00 = Explicit Congestion Notification: Not-ECT (Not ECN-Capable Transport) (0x00)
    Total Length: 576
    Identification: 0xd0f4 (53492)
    Flags: 0x00
        0... .... = Reserved bit: Not set
        .0.. .... = Don't fragment: Not set
        ..0. .... = More fragments: Not set
    Fragment offset: 0
    Time to live: 64
    Protocol: UDP (17)
    Header checksum: 0xccb2 [validation disabled]
        [Good: False]
        [Bad: False]
    Source: 192.168.25.2 (192.168.25.2)
    Destination: 52.50.205.41 (52.50.205.41)
User Datagram Protocol, Src Port: 5060 (5060), Dst Port: 5060 (5060)
    Source port: 5060 (5060)
    Destination port: 5060 (5060)
    Length: 556
    Checksum: 0xdd43 [validation disabled]
        [Good Checksum: False]
        [Bad Checksum: False]
Session Initiation Protocol (100)
    Status-Line: SIP/2.0 100 Trying
        Status-Code: 100
        [Resent Packet: False]
        [Request Frame: 1940]
        [Response Time (ms): 1]
    Message Header
        Via: SIP/2.0/UDP 52.50.205.41:5060;branch=z9hG4bK6a8f.e00550c7.0;i=9;received=52.50.205.41
            Transport: UDP
            Sent-by Address: 52.50.205.41
            Sent-by port: 5060
            Branch: z9hG4bK6a8f.e00550c7.0
            i=9
            Received: 52.50.205.41
        From: "Ahmed Shabrawy"<sip:1100@cequens.com;user=phone>;epid=5945353D84;tag=c0f7409094
            SIP Display info: "Ahmed Shabrawy"
            SIP from address: sip:1100@cequens.com;user=phone
                SIP from address User Part: 1100
                SIP from address Host Part: cequens.com
                SIP From URI parameter: user=phone
            SIP from tag: c0f7409094
        To: <sip:201006683021@sip.cequens.net;user=phone>
            SIP to address: sip:201006683021@sip.cequens.net;user=phone
                SIP to address User Part: 201006683021
                SIP to address Host Part: sip.cequens.net
                SIP To URI parameter: user=phone
        Call-ID: 4df62d77-f7b2-4377-a8b6-abe614ab9c0f
        CSeq: 28537 INVITE
            Sequence Number: 28537
            Method: INVITE
        Server: Asterisk PBX GIT-master-95cf4f8
        Allow: INVITE, ACK, CANCEL, OPTIONS, BYE, REFER, SUBSCRIBE, NOTIFY, INFO, PUBLISH, MESSAGE
        Supported: replaces, timer
        Contact: <sip:+201006683021@37.76.239.43:5060>
            Contact URI: sip:+201006683021@37.76.239.43:5060
                Contact URI User Part: +201006683021
                Contact URI Host Part: 37.76.239.43
                Contact URI Host Port: 5060
        Content-Length: 0

Frame 2798: 606 bytes on wire (4848 bits), 606 bytes captured (4848 bits) on interface 0
    Interface id: 0
    Encapsulation type: Ethernet (1)
    Arrival Time: May  2, 2017 17:02:03.961763132 EDT
    [Time shift for this packet: 0.000000000 seconds]
    Epoch Time: 1493758923.961763132 seconds
    [Time delta from previous captured frame: 0.019566966 seconds]
    [Time delta from previous displayed frame: 6.556824097 seconds]
    [Time since reference or first frame: 26.783108828 seconds]
    Frame Number: 2798
    Frame Length: 606 bytes (4848 bits)
    Capture Length: 606 bytes (4848 bits)
    [Frame is marked: False]
    [Frame is ignored: False]
    [Protocols in frame: eth:ip:udp:sip]
Ethernet II, Src: c8:1f:66:ea:a9:6c (c8:1f:66:ea:a9:6c), Dst: a8:9d:21:92:e2:1b (a8:9d:21:92:e2:1b)
    Destination: a8:9d:21:92:e2:1b (a8:9d:21:92:e2:1b)
        Address: a8:9d:21:92:e2:1b (a8:9d:21:92:e2:1b)
        .... ..0. .... .... .... .... = LG bit: Globally unique address (factory default)
        .... ...0 .... .... .... .... = IG bit: Individual address (unicast)
    Source: c8:1f:66:ea:a9:6c (c8:1f:66:ea:a9:6c)
        Address: c8:1f:66:ea:a9:6c (c8:1f:66:ea:a9:6c)
        .... ..0. .... .... .... .... = LG bit: Globally unique address (factory default)
        .... ...0 .... .... .... .... = IG bit: Individual address (unicast)
    Type: IP (0x0800)
Internet Protocol Version 4, Src: 192.168.25.2 (192.168.25.2), Dst: 52.50.205.41 (52.50.205.41)
    Version: 4
    Header length: 20 bytes
    Differentiated Services Field: 0x00 (DSCP 0x00: Default; ECN: 0x00: Not-ECT (Not ECN-Capable Transport))
        0000 00.. = Differentiated Services Codepoint: Default (0x00)
        .... ..00 = Explicit Congestion Notification: Not-ECT (Not ECN-Capable Transport) (0x00)
    Total Length: 592
    Identification: 0xd0f5 (53493)
    Flags: 0x00
        0... .... = Reserved bit: Not set
        .0.. .... = Don't fragment: Not set
        ..0. .... = More fragments: Not set
    Fragment offset: 0
    Time to live: 64
    Protocol: UDP (17)
    Header checksum: 0xcca1 [validation disabled]
        [Good: False]
        [Bad: False]
    Source: 192.168.25.2 (192.168.25.2)
    Destination: 52.50.205.41 (52.50.205.41)
User Datagram Protocol, Src Port: 5060 (5060), Dst Port: 5060 (5060)
    Source port: 5060 (5060)
    Destination port: 5060 (5060)
    Length: 572
    Checksum: 0xdd53 [validation disabled]
        [Good Checksum: False]
        [Bad Checksum: False]
Session Initiation Protocol (180)
    Status-Line: SIP/2.0 180 Ringing
        Status-Code: 180
        [Resent Packet: False]
        [Request Frame: 1940]
        [Response Time (ms): 6558]
    Message Header
        Via: SIP/2.0/UDP 52.50.205.41:5060;branch=z9hG4bK6a8f.e00550c7.0;i=9;received=52.50.205.41
            Transport: UDP
            Sent-by Address: 52.50.205.41
            Sent-by port: 5060
            Branch: z9hG4bK6a8f.e00550c7.0
            i=9
            Received: 52.50.205.41
        From: "Ahmed Shabrawy"<sip:1100@cequens.com;user=phone>;epid=5945353D84;tag=c0f7409094
            SIP Display info: "Ahmed Shabrawy"
            SIP from address: sip:1100@cequens.com;user=phone
                SIP from address User Part: 1100
                SIP from address Host Part: cequens.com
                SIP From URI parameter: user=phone
            SIP from tag: c0f7409094
        To: <sip:201006683021@sip.cequens.net;user=phone>;tag=as21be6ffa
            SIP to address: sip:201006683021@sip.cequens.net;user=phone
                SIP to address User Part: 201006683021
                SIP to address Host Part: sip.cequens.net
                SIP To URI parameter: user=phone
            SIP to tag: as21be6ffa
        Call-ID: 4df62d77-f7b2-4377-a8b6-abe614ab9c0f
        CSeq: 28537 INVITE
            Sequence Number: 28537
            Method: INVITE
        Server: Asterisk PBX GIT-master-95cf4f8
        Allow: INVITE, ACK, CANCEL, OPTIONS, BYE, REFER, SUBSCRIBE, NOTIFY, INFO, PUBLISH, MESSAGE
        Supported: replaces, timer
        Contact: <sip:+201006683021@37.76.239.43:5060>
            Contact URI: sip:+201006683021@37.76.239.43:5060
                Contact URI User Part: +201006683021
                Contact URI Host Part: 37.76.239.43
                Contact URI Host Port: 5060
        Content-Length: 0

Frame 2799: 921 bytes on wire (7368 bits), 921 bytes captured (7368 bits) on interface 0
    Interface id: 0
    Encapsulation type: Ethernet (1)
    Arrival Time: May  2, 2017 17:02:03.962086773 EDT
    [Time shift for this packet: 0.000000000 seconds]
    Epoch Time: 1493758923.962086773 seconds
    [Time delta from previous captured frame: 0.000323641 seconds]
    [Time delta from previous displayed frame: 0.000323641 seconds]
    [Time since reference or first frame: 26.783432469 seconds]
    Frame Number: 2799
    Frame Length: 921 bytes (7368 bits)
    Capture Length: 921 bytes (7368 bits)
    [Frame is marked: False]
    [Frame is ignored: False]
    [Protocols in frame: eth:ip:udp:sip:sdp]
Ethernet II, Src: c8:1f:66:ea:a9:6c (c8:1f:66:ea:a9:6c), Dst: a8:9d:21:92:e2:1b (a8:9d:21:92:e2:1b)
    Destination: a8:9d:21:92:e2:1b (a8:9d:21:92:e2:1b)
        Address: a8:9d:21:92:e2:1b (a8:9d:21:92:e2:1b)
        .... ..0. .... .... .... .... = LG bit: Globally unique address (factory default)
        .... ...0 .... .... .... .... = IG bit: Individual address (unicast)
    Source: c8:1f:66:ea:a9:6c (c8:1f:66:ea:a9:6c)
        Address: c8:1f:66:ea:a9:6c (c8:1f:66:ea:a9:6c)
        .... ..0. .... .... .... .... = LG bit: Globally unique address (factory default)
        .... ...0 .... .... .... .... = IG bit: Individual address (unicast)
    Type: IP (0x0800)
Internet Protocol Version 4, Src: 192.168.25.2 (192.168.25.2), Dst: 52.50.205.41 (52.50.205.41)
    Version: 4
    Header length: 20 bytes
    Differentiated Services Field: 0x00 (DSCP 0x00: Default; ECN: 0x00: Not-ECT (Not ECN-Capable Transport))
        0000 00.. = Differentiated Services Codepoint: Default (0x00)
        .... ..00 = Explicit Congestion Notification: Not-ECT (Not ECN-Capable Transport) (0x00)
    Total Length: 907
    Identification: 0xd0f6 (53494)
    Flags: 0x00
        0... .... = Reserved bit: Not set
        .0.. .... = Don't fragment: Not set
        ..0. .... = More fragments: Not set
    Fragment offset: 0
    Time to live: 64
    Protocol: UDP (17)
    Header checksum: 0xcb65 [validation disabled]
        [Good: False]
        [Bad: False]
    Source: 192.168.25.2 (192.168.25.2)
    Destination: 52.50.205.41 (52.50.205.41)
User Datagram Protocol, Src Port: 5060 (5060), Dst Port: 5060 (5060)
    Source port: 5060 (5060)
    Destination port: 5060 (5060)
    Length: 887
    Checksum: 0xde8e [validation disabled]
        [Good Checksum: False]
        [Bad Checksum: False]
Session Initiation Protocol (183)
    Status-Line: SIP/2.0 183 Session Progress
        Status-Code: 183
        [Resent Packet: False]
        [Request Frame: 1940]
        [Response Time (ms): 6558]
    Message Header
        Via: SIP/2.0/UDP 52.50.205.41:5060;branch=z9hG4bK6a8f.e00550c7.0;i=9;received=52.50.205.41
            Transport: UDP
            Sent-by Address: 52.50.205.41
            Sent-by port: 5060
            Branch: z9hG4bK6a8f.e00550c7.0
            i=9
            Received: 52.50.205.41
        From: "Ahmed Shabrawy"<sip:1100@cequens.com;user=phone>;epid=5945353D84;tag=c0f7409094
            SIP Display info: "Ahmed Shabrawy"
            SIP from address: sip:1100@cequens.com;user=phone
                SIP from address User Part: 1100
                SIP from address Host Part: cequens.com
                SIP From URI parameter: user=phone
            SIP from tag: c0f7409094
        To: <sip:201006683021@sip.cequens.net;user=phone>;tag=as21be6ffa
            SIP to address: sip:201006683021@sip.cequens.net;user=phone
                SIP to address User Part: 201006683021
                SIP to address Host Part: sip.cequens.net
                SIP To URI parameter: user=phone
            SIP to tag: as21be6ffa
        Call-ID: 4df62d77-f7b2-4377-a8b6-abe614ab9c0f
        CSeq: 28537 INVITE
            Sequence Number: 28537
            Method: INVITE
        Server: Asterisk PBX GIT-master-95cf4f8
        Allow: INVITE, ACK, CANCEL, OPTIONS, BYE, REFER, SUBSCRIBE, NOTIFY, INFO, PUBLISH, MESSAGE
        Supported: replaces, timer
        Contact: <sip:+201006683021@37.76.239.43:5060>
            Contact URI: sip:+201006683021@37.76.239.43:5060
                Contact URI User Part: +201006683021
                Contact URI Host Part: 37.76.239.43
                Contact URI Host Port: 5060
        Content-Type: application/sdp
        Content-Length: 273
    Message Body
        Session Description Protocol
            Session Description Protocol Version (v): 0
            Owner/Creator, Session Id (o): root 741213253 741213253 IN IP4 37.76.239.43
                Owner Username: root
                Session ID: 741213253
                Session Version: 741213253
                Owner Network Type: IN
                Owner Address Type: IP4
                Owner Address: 37.76.239.43
            Session Name (s): Asterisk PBX GIT-master-95cf4f8
            Connection Information (c): IN IP4 37.76.239.43
                Connection Network Type: IN
                Connection Address Type: IP4
                Connection Address: 37.76.239.43
            Time Description, active time (t): 0 0
                Session Start Time: 0
                Session Stop Time: 0
            Media Description, name and address (m): audio 18636 RTP/AVP 0 8 101
                Media Type: audio
                Media Port: 18636
                Media Protocol: RTP/AVP
                Media Format: ITU-T G.711 PCMU
                Media Format: ITU-T G.711 PCMA
                Media Format: DynamicRTP-Type-101
            Media Attribute (a): rtpmap:0 PCMU/8000
                Media Attribute Fieldname: rtpmap
                Media Format: 0
                MIME Type: PCMU
                Sample Rate: 8000
            Media Attribute (a): rtpmap:8 PCMA/8000
                Media Attribute Fieldname: rtpmap
                Media Format: 8
                MIME Type: PCMA
                Sample Rate: 8000
            Media Attribute (a): rtpmap:101 telephone-event/8000
                Media Attribute Fieldname: rtpmap
                Media Format: 101
                MIME Type: telephone-event
                Sample Rate: 8000
            Media Attribute (a): fmtp:101 0-16
                Media Attribute Fieldname: fmtp
                Media Format: 101 [telephone-event]
                Media format specific parameters: 0-16
            Media Attribute (a): maxptime:150
                Media Attribute Fieldname: maxptime
                Media Attribute Value: 150
            Media Attribute (a): sendrecv

Frame 3608: 907 bytes on wire (7256 bits), 907 bytes captured (7256 bits) on interface 0
    Interface id: 0
    Encapsulation type: Ethernet (1)
    Arrival Time: May  2, 2017 17:02:08.821632585 EDT
    [Time shift for this packet: 0.000000000 seconds]
    Epoch Time: 1493758928.821632585 seconds
    [Time delta from previous captured frame: 0.018350985 seconds]
    [Time delta from previous displayed frame: 4.859545812 seconds]
    [Time since reference or first frame: 31.642978281 seconds]
    Frame Number: 3608
    Frame Length: 907 bytes (7256 bits)
    Capture Length: 907 bytes (7256 bits)
    [Frame is marked: False]
    [Frame is ignored: False]
    [Protocols in frame: eth:ip:udp:sip:sdp]
Ethernet II, Src: c8:1f:66:ea:a9:6c (c8:1f:66:ea:a9:6c), Dst: a8:9d:21:92:e2:1b (a8:9d:21:92:e2:1b)
    Destination: a8:9d:21:92:e2:1b (a8:9d:21:92:e2:1b)
        Address: a8:9d:21:92:e2:1b (a8:9d:21:92:e2:1b)
        .... ..0. .... .... .... .... = LG bit: Globally unique address (factory default)
        .... ...0 .... .... .... .... = IG bit: Individual address (unicast)
    Source: c8:1f:66:ea:a9:6c (c8:1f:66:ea:a9:6c)
        Address: c8:1f:66:ea:a9:6c (c8:1f:66:ea:a9:6c)
        .... ..0. .... .... .... .... = LG bit: Globally unique address (factory default)
        .... ...0 .... .... .... .... = IG bit: Individual address (unicast)
    Type: IP (0x0800)
Internet Protocol Version 4, Src: 192.168.25.2 (192.168.25.2), Dst: 52.50.205.41 (52.50.205.41)
    Version: 4
    Header length: 20 bytes
    Differentiated Services Field: 0x00 (DSCP 0x00: Default; ECN: 0x00: Not-ECT (Not ECN-Capable Transport))
        0000 00.. = Differentiated Services Codepoint: Default (0x00)
        .... ..00 = Explicit Congestion Notification: Not-ECT (Not ECN-Capable Transport) (0x00)
    Total Length: 893
    Identification: 0xd0f7 (53495)
    Flags: 0x00
        0... .... = Reserved bit: Not set
        .0.. .... = Don't fragment: Not set
        ..0. .... = More fragments: Not set
    Fragment offset: 0
    Time to live: 64
    Protocol: UDP (17)
    Header checksum: 0xcb72 [validation disabled]
        [Good: False]
        [Bad: False]
    Source: 192.168.25.2 (192.168.25.2)
    Destination: 52.50.205.41 (52.50.205.41)
User Datagram Protocol, Src Port: 5060 (5060), Dst Port: 5060 (5060)
    Source port: 5060 (5060)
    Destination port: 5060 (5060)
    Length: 873
    Checksum: 0xde80 [validation disabled]
        [Good Checksum: False]
        [Bad Checksum: False]
Session Initiation Protocol (200)
    Status-Line: SIP/2.0 200 OK
        Status-Code: 200
        [Resent Packet: False]
        [Request Frame: 1940]
        [Response Time (ms): 11418]
    Message Header
        Via: SIP/2.0/UDP 52.50.205.41:5060;branch=z9hG4bK6a8f.e00550c7.0;i=9;received=52.50.205.41
            Transport: UDP
            Sent-by Address: 52.50.205.41
            Sent-by port: 5060
            Branch: z9hG4bK6a8f.e00550c7.0
            i=9
            Received: 52.50.205.41
        From: "Ahmed Shabrawy"<sip:1100@cequens.com;user=phone>;epid=5945353D84;tag=c0f7409094
            SIP Display info: "Ahmed Shabrawy"
            SIP from address: sip:1100@cequens.com;user=phone
                SIP from address User Part: 1100
                SIP from address Host Part: cequens.com
                SIP From URI parameter: user=phone
            SIP from tag: c0f7409094
        To: <sip:201006683021@sip.cequens.net;user=phone>;tag=as21be6ffa
            SIP to address: sip:201006683021@sip.cequens.net;user=phone
                SIP to address User Part: 201006683021
                SIP to address Host Part: sip.cequens.net
                SIP To URI parameter: user=phone
            SIP to tag: as21be6ffa
        Call-ID: 4df62d77-f7b2-4377-a8b6-abe614ab9c0f
        CSeq: 28537 INVITE
            Sequence Number: 28537
            Method: INVITE
        Server: Asterisk PBX GIT-master-95cf4f8
        Allow: INVITE, ACK, CANCEL, OPTIONS, BYE, REFER, SUBSCRIBE, NOTIFY, INFO, PUBLISH, MESSAGE
        Supported: replaces, timer
        Contact: <sip:+201006683021@37.76.239.43:5060>
            Contact URI: sip:+201006683021@37.76.239.43:5060
                Contact URI User Part: +201006683021
                Contact URI Host Part: 37.76.239.43
                Contact URI Host Port: 5060
        Content-Type: application/sdp
        Content-Length: 273
    Message Body
        Session Description Protocol
            Session Description Protocol Version (v): 0
            Owner/Creator, Session Id (o): root 741213253 741213253 IN IP4 37.76.239.43
                Owner Username: root
                Session ID: 741213253
                Session Version: 741213253
                Owner Network Type: IN
                Owner Address Type: IP4
                Owner Address: 37.76.239.43
            Session Name (s): Asterisk PBX GIT-master-95cf4f8
            Connection Information (c): IN IP4 37.76.239.43
                Connection Network Type: IN
                Connection Address Type: IP4
                Connection Address: 37.76.239.43
            Time Description, active time (t): 0 0
                Session Start Time: 0
                Session Stop Time: 0
            Media Description, name and address (m): audio 18636 RTP/AVP 0 8 101
                Media Type: audio
                Media Port: 18636
                Media Protocol: RTP/AVP
                Media Format: ITU-T G.711 PCMU
                Media Format: ITU-T G.711 PCMA
                Media Format: DynamicRTP-Type-101
            Media Attribute (a): rtpmap:0 PCMU/8000
                Media Attribute Fieldname: rtpmap
                Media Format: 0
                MIME Type: PCMU
                Sample Rate: 8000
            Media Attribute (a): rtpmap:8 PCMA/8000
                Media Attribute Fieldname: rtpmap
                Media Format: 8
                MIME Type: PCMA
                Sample Rate: 8000
            Media Attribute (a): rtpmap:101 telephone-event/8000
                Media Attribute Fieldname: rtpmap
                Media Format: 101
                MIME Type: telephone-event
                Sample Rate: 8000
            Media Attribute (a): fmtp:101 0-16
                Media Attribute Fieldname: fmtp
                Media Format: 101 [telephone-event]
                Media format specific parameters: 0-16
            Media Attribute (a): maxptime:150
                Media Attribute Fieldname: maxptime
                Media Attribute Value: 150
            Media Attribute (a): sendrecv

Frame 3635: 907 bytes on wire (7256 bits), 907 bytes captured (7256 bits) on interface 0
    Interface id: 0
    Encapsulation type: Ethernet (1)
    Arrival Time: May  2, 2017 17:02:08.924539618 EDT
    [Time shift for this packet: 0.000000000 seconds]
    Epoch Time: 1493758928.924539618 seconds
    [Time delta from previous captured frame: 0.003600525 seconds]
    [Time delta from previous displayed frame: 0.102907033 seconds]
    [Time since reference or first frame: 31.745885314 seconds]
    Frame Number: 3635
    Frame Length: 907 bytes (7256 bits)
    Capture Length: 907 bytes (7256 bits)
    [Frame is marked: False]
    [Frame is ignored: False]
    [Protocols in frame: eth:ip:udp:sip:sdp]
Ethernet II, Src: c8:1f:66:ea:a9:6c (c8:1f:66:ea:a9:6c), Dst: a8:9d:21:92:e2:1b (a8:9d:21:92:e2:1b)
    Destination: a8:9d:21:92:e2:1b (a8:9d:21:92:e2:1b)
        Address: a8:9d:21:92:e2:1b (a8:9d:21:92:e2:1b)
        .... ..0. .... .... .... .... = LG bit: Globally unique address (factory default)
        .... ...0 .... .... .... .... = IG bit: Individual address (unicast)
    Source: c8:1f:66:ea:a9:6c (c8:1f:66:ea:a9:6c)
        Address: c8:1f:66:ea:a9:6c (c8:1f:66:ea:a9:6c)
        .... ..0. .... .... .... .... = LG bit: Globally unique address (factory default)
        .... ...0 .... .... .... .... = IG bit: Individual address (unicast)
    Type: IP (0x0800)
Internet Protocol Version 4, Src: 192.168.25.2 (192.168.25.2), Dst: 52.50.205.41 (52.50.205.41)
    Version: 4
    Header length: 20 bytes
    Differentiated Services Field: 0x00 (DSCP 0x00: Default; ECN: 0x00: Not-ECT (Not ECN-Capable Transport))
        0000 00.. = Differentiated Services Codepoint: Default (0x00)
        .... ..00 = Explicit Congestion Notification: Not-ECT (Not ECN-Capable Transport) (0x00)
    Total Length: 893
    Identification: 0xd0f8 (53496)
    Flags: 0x00
        0... .... = Reserved bit: Not set
        .0.. .... = Don't fragment: Not set
        ..0. .... = More fragments: Not set
    Fragment offset: 0
    Time to live: 64
    Protocol: UDP (17)
    Header checksum: 0xcb71 [validation disabled]
        [Good: False]
        [Bad: False]
    Source: 192.168.25.2 (192.168.25.2)
    Destination: 52.50.205.41 (52.50.205.41)
User Datagram Protocol, Src Port: 5060 (5060), Dst Port: 5060 (5060)
    Source port: 5060 (5060)
    Destination port: 5060 (5060)
    Length: 873
    Checksum: 0xde80 [validation disabled]
        [Good Checksum: False]
        [Bad Checksum: False]
Session Initiation Protocol (200)
    Status-Line: SIP/2.0 200 OK
        Status-Code: 200
        [Resent Packet: True]
        [Suspected resend of frame: 3608]
        [Request Frame: 1940]
        [Response Time (ms): 11521]
    Message Header
        Via: SIP/2.0/UDP 52.50.205.41:5060;branch=z9hG4bK6a8f.e00550c7.0;i=9;received=52.50.205.41
            Transport: UDP
            Sent-by Address: 52.50.205.41
            Sent-by port: 5060
            Branch: z9hG4bK6a8f.e00550c7.0
            i=9
            Received: 52.50.205.41
        From: "Ahmed Shabrawy"<sip:1100@cequens.com;user=phone>;epid=5945353D84;tag=c0f7409094
            SIP Display info: "Ahmed Shabrawy"
            SIP from address: sip:1100@cequens.com;user=phone
                SIP from address User Part: 1100
                SIP from address Host Part: cequens.com
                SIP From URI parameter: user=phone
            SIP from tag: c0f7409094
        To: <sip:201006683021@sip.cequens.net;user=phone>;tag=as21be6ffa
            SIP to address: sip:201006683021@sip.cequens.net;user=phone
                SIP to address User Part: 201006683021
                SIP to address Host Part: sip.cequens.net
                SIP To URI parameter: user=phone
            SIP to tag: as21be6ffa
        Call-ID: 4df62d77-f7b2-4377-a8b6-abe614ab9c0f
        CSeq: 28537 INVITE
            Sequence Number: 28537
            Method: INVITE
        Server: Asterisk PBX GIT-master-95cf4f8
        Allow: INVITE, ACK, CANCEL, OPTIONS, BYE, REFER, SUBSCRIBE, NOTIFY, INFO, PUBLISH, MESSAGE
        Supported: replaces, timer
        Contact: <sip:+201006683021@37.76.239.43:5060>
            Contact URI: sip:+201006683021@37.76.239.43:5060
                Contact URI User Part: +201006683021
                Contact URI Host Part: 37.76.239.43
                Contact URI Host Port: 5060
        Content-Type: application/sdp
        Content-Length: 273
    Message Body
        Session Description Protocol
            Session Description Protocol Version (v): 0
            Owner/Creator, Session Id (o): root 741213253 741213253 IN IP4 37.76.239.43
                Owner Username: root
                Session ID: 741213253
                Session Version: 741213253
                Owner Network Type: IN
                Owner Address Type: IP4
                Owner Address: 37.76.239.43
            Session Name (s): Asterisk PBX GIT-master-95cf4f8
            Connection Information (c): IN IP4 37.76.239.43
                Connection Network Type: IN
                Connection Address Type: IP4
                Connection Address: 37.76.239.43
            Time Description, active time (t): 0 0
                Session Start Time: 0
                Session Stop Time: 0
            Media Description, name and address (m): audio 18636 RTP/AVP 0 8 101
                Media Type: audio
                Media Port: 18636
                Media Protocol: RTP/AVP
                Media Format: ITU-T G.711 PCMU
                Media Format: ITU-T G.711 PCMA
                Media Format: DynamicRTP-Type-101
            Media Attribute (a): rtpmap:0 PCMU/8000
                Media Attribute Fieldname: rtpmap
                Media Format: 0
                MIME Type: PCMU
                Sample Rate: 8000
            Media Attribute (a): rtpmap:8 PCMA/8000
                Media Attribute Fieldname: rtpmap
                Media Format: 8
                MIME Type: PCMA
                Sample Rate: 8000
            Media Attribute (a): rtpmap:101 telephone-event/8000
                Media Attribute Fieldname: rtpmap
                Media Format: 101
                MIME Type: telephone-event
                Sample Rate: 8000
            Media Attribute (a): fmtp:101 0-16
                Media Attribute Fieldname: fmtp
                Media Format: 101 [telephone-event]
                Media format specific parameters: 0-16
            Media Attribute (a): maxptime:150
                Media Attribute Fieldname: maxptime
                Media Attribute Value: 150
            Media Attribute (a): sendrecv

Frame 3655: 444 bytes on wire (3552 bits), 444 bytes captured (3552 bits) on interface 0
    Interface id: 0
    Encapsulation type: Ethernet (1)
    Arrival Time: May  2, 2017 17:02:09.014695197 EDT
    [Time shift for this packet: 0.000000000 seconds]
    Epoch Time: 1493758929.014695197 seconds
    [Time delta from previous captured frame: 0.002158447 seconds]
    [Time delta from previous displayed frame: 0.090155579 seconds]
    [Time since reference or first frame: 31.836040893 seconds]
    Frame Number: 3655
    Frame Length: 444 bytes (3552 bits)
    Capture Length: 444 bytes (3552 bits)
    [Frame is marked: False]
    [Frame is ignored: False]
    [Protocols in frame: eth:ip:udp:sip]
Ethernet II, Src: a8:9d:21:92:e2:1b (a8:9d:21:92:e2:1b), Dst: c8:1f:66:ea:a9:6c (c8:1f:66:ea:a9:6c)
    Destination: c8:1f:66:ea:a9:6c (c8:1f:66:ea:a9:6c)
        Address: c8:1f:66:ea:a9:6c (c8:1f:66:ea:a9:6c)
        .... ..0. .... .... .... .... = LG bit: Globally unique address (factory default)
        .... ...0 .... .... .... .... = IG bit: Individual address (unicast)
    Source: a8:9d:21:92:e2:1b (a8:9d:21:92:e2:1b)
        Address: a8:9d:21:92:e2:1b (a8:9d:21:92:e2:1b)
        .... ..0. .... .... .... .... = LG bit: Globally unique address (factory default)
        .... ...0 .... .... .... .... = IG bit: Individual address (unicast)
    Type: IP (0x0800)
Internet Protocol Version 4, Src: 52.50.205.41 (52.50.205.41), Dst: 192.168.25.2 (192.168.25.2)
    Version: 4
    Header length: 20 bytes
    Differentiated Services Field: 0x00 (DSCP 0x00: Default; ECN: 0x00: Not-ECT (Not ECN-Capable Transport))
        0000 00.. = Differentiated Services Codepoint: Default (0x00)
        .... ..00 = Explicit Congestion Notification: Not-ECT (Not ECN-Capable Transport) (0x00)
    Total Length: 430
    Identification: 0xafbd (44989)
    Flags: 0x02 (Don't Fragment)
        0... .... = Reserved bit: Not set
        .1.. .... = Don't fragment: Set
        ..0. .... = More fragments: Not set
    Fragment offset: 0
    Time to live: 43
    Protocol: UDP (17)
    Header checksum: 0xc37b [validation disabled]
        [Good: False]
        [Bad: False]
    Source: 52.50.205.41 (52.50.205.41)
    Destination: 192.168.25.2 (192.168.25.2)
User Datagram Protocol, Src Port: 5060 (5060), Dst Port: 5060 (5060)
    Source port: 5060 (5060)
    Destination port: 5060 (5060)
    Length: 410
    Checksum: 0x3a83 [validation disabled]
        [Good Checksum: False]
        [Bad Checksum: False]
Session Initiation Protocol (ACK)
    Request-Line: ACK sip:+201006683021@37.76.239.43:5060 SIP/2.0
        Method: ACK
        Request-URI: sip:+201006683021@37.76.239.43:5060
            Request-URI User Part: +201006683021
            Request-URI Host Part: 37.76.239.43
            Request-URI Host Port: 5060
        [Resent Packet: False]
        [Request Frame: 1940]
        [Response Time (ms): 11612]
    Message Header
        FROM: <sip:1100@cequens.com;user=phone>;epid=5945353D84;tag=c0f7409094
            SIP from address: sip:1100@cequens.com;user=phone
                SIP from address User Part: 1100
                SIP from address Host Part: cequens.com
                SIP From URI parameter: user=phone
            SIP from tag: c0f7409094
        TO: <sip:201006683021@sip.cequens.net;user=phone>;tag=as21be6ffa
            SIP to address: sip:201006683021@sip.cequens.net;user=phone
                SIP to address User Part: 201006683021
                SIP to address Host Part: sip.cequens.net
                SIP To URI parameter: user=phone
            SIP to tag: as21be6ffa
        CSEQ: 28537 ACK
            Sequence Number: 28537
            Method: ACK
        CALL-ID: 4df62d77-f7b2-4377-a8b6-abe614ab9c0f
        Max-Forwards: 69
        Via: SIP/2.0/UDP 52.50.205.41:5060;branch=z9hG4bK6a8f.e00550c7.2;i=9
            Transport: UDP
            Sent-by Address: 52.50.205.41
            Sent-by port: 5060
            Branch: z9hG4bK6a8f.e00550c7.2
            i=9
        CONTENT-LENGTH: 0
        USER-AGENT: RTCC/5.0.0.0 MediationServer

Frame 4677: 488 bytes on wire (3904 bits), 488 bytes captured (3904 bits) on interface 0
    Interface id: 0
    Encapsulation type: Ethernet (1)
    Arrival Time: May  2, 2017 17:02:16.164338653 EDT
    [Time shift for this packet: 0.000000000 seconds]
    Epoch Time: 1493758936.164338653 seconds
    [Time delta from previous captured frame: 0.003158221 seconds]
    [Time delta from previous displayed frame: 7.149643456 seconds]
    [Time since reference or first frame: 38.985684349 seconds]
    Frame Number: 4677
    Frame Length: 488 bytes (3904 bits)
    Capture Length: 488 bytes (3904 bits)
    [Frame is marked: False]
    [Frame is ignored: False]
    [Protocols in frame: eth:ip:udp:sip]
Ethernet II, Src: a8:9d:21:92:e2:1b (a8:9d:21:92:e2:1b), Dst: c8:1f:66:ea:a9:6c (c8:1f:66:ea:a9:6c)
    Destination: c8:1f:66:ea:a9:6c (c8:1f:66:ea:a9:6c)
        Address: c8:1f:66:ea:a9:6c (c8:1f:66:ea:a9:6c)
        .... ..0. .... .... .... .... = LG bit: Globally unique address (factory default)
        .... ...0 .... .... .... .... = IG bit: Individual address (unicast)
    Source: a8:9d:21:92:e2:1b (a8:9d:21:92:e2:1b)
        Address: a8:9d:21:92:e2:1b (a8:9d:21:92:e2:1b)
        .... ..0. .... .... .... .... = LG bit: Globally unique address (factory default)
        .... ...0 .... .... .... .... = IG bit: Individual address (unicast)
    Type: IP (0x0800)
Internet Protocol Version 4, Src: 52.50.205.41 (52.50.205.41), Dst: 192.168.25.2 (192.168.25.2)
    Version: 4
    Header length: 20 bytes
    Differentiated Services Field: 0x00 (DSCP 0x00: Default; ECN: 0x00: Not-ECT (Not ECN-Capable Transport))
        0000 00.. = Differentiated Services Codepoint: Default (0x00)
        .... ..00 = Explicit Congestion Notification: Not-ECT (Not ECN-Capable Transport) (0x00)
    Total Length: 474
    Identification: 0xb615 (46613)
    Flags: 0x02 (Don't Fragment)
        0... .... = Reserved bit: Not set
        .1.. .... = Don't fragment: Set
        ..0. .... = More fragments: Not set
    Fragment offset: 0
    Time to live: 43
    Protocol: UDP (17)
    Header checksum: 0xbcf7 [validation disabled]
        [Good: False]
        [Bad: False]
    Source: 52.50.205.41 (52.50.205.41)
    Destination: 192.168.25.2 (192.168.25.2)
User Datagram Protocol, Src Port: 5060 (5060), Dst Port: 5060 (5060)
    Source port: 5060 (5060)
    Destination port: 5060 (5060)
    Length: 454
    Checksum: 0x5db8 [validation disabled]
        [Good Checksum: False]
        [Bad Checksum: False]
Session Initiation Protocol (BYE)
    Request-Line: BYE sip:+201006683021@37.76.239.43:5060 SIP/2.0
        Method: BYE
        Request-URI: sip:+201006683021@37.76.239.43:5060
            Request-URI User Part: +201006683021
            Request-URI Host Part: 37.76.239.43
            Request-URI Host Port: 5060
        [Resent Packet: False]
    Message Header
        FROM: <sip:1100@cequens.com;user=phone>;epid=5945353D84;tag=c0f7409094
            SIP from address: sip:1100@cequens.com;user=phone
                SIP from address User Part: 1100
                SIP from address Host Part: cequens.com
                SIP From URI parameter: user=phone
            SIP from tag: c0f7409094
        TO: <sip:201006683021@sip.cequens.net;user=phone>;tag=as21be6ffa
            SIP to address: sip:201006683021@sip.cequens.net;user=phone
                SIP to address User Part: 201006683021
                SIP to address Host Part: sip.cequens.net
                SIP To URI parameter: user=phone
            SIP to tag: as21be6ffa
        CSEQ: 28538 BYE
            Sequence Number: 28538
            Method: BYE
        CALL-ID: 4df62d77-f7b2-4377-a8b6-abe614ab9c0f
        Max-Forwards: 69
        Via: SIP/2.0/UDP 52.50.205.41:5060;branch=z9hG4bK4b8f.5f777c14.0;i=9
            Transport: UDP
            Sent-by Address: 52.50.205.41
            Sent-by port: 5060
            Branch: z9hG4bK4b8f.5f777c14.0
            i=9
        CONTACT: <sip:52.50.205.41;did=89.63ab84f>
            Contact URI: sip:52.50.205.41;did=89.63ab84f
                Contact URI Host Part: 52.50.205.41
                Contact URI parameter: did=89.63ab84f
        CONTENT-LENGTH: 0
        USER-AGENT: RTCC/5.0.0.0 MediationServer

Frame 4678: 534 bytes on wire (4272 bits), 534 bytes captured (4272 bits) on interface 0
    Interface id: 0
    Encapsulation type: Ethernet (1)
    Arrival Time: May  2, 2017 17:02:16.165592326 EDT
    [Time shift for this packet: 0.000000000 seconds]
    Epoch Time: 1493758936.165592326 seconds
    [Time delta from previous captured frame: 0.001253673 seconds]
    [Time delta from previous displayed frame: 0.001253673 seconds]
    [Time since reference or first frame: 38.986938022 seconds]
    Frame Number: 4678
    Frame Length: 534 bytes (4272 bits)
    Capture Length: 534 bytes (4272 bits)
    [Frame is marked: False]
    [Frame is ignored: False]
    [Protocols in frame: eth:ip:udp:sip]
Ethernet II, Src: c8:1f:66:ea:a9:6c (c8:1f:66:ea:a9:6c), Dst: a8:9d:21:92:e2:1b (a8:9d:21:92:e2:1b)
    Destination: a8:9d:21:92:e2:1b (a8:9d:21:92:e2:1b)
        Address: a8:9d:21:92:e2:1b (a8:9d:21:92:e2:1b)
        .... ..0. .... .... .... .... = LG bit: Globally unique address (factory default)
        .... ...0 .... .... .... .... = IG bit: Individual address (unicast)
    Source: c8:1f:66:ea:a9:6c (c8:1f:66:ea:a9:6c)
        Address: c8:1f:66:ea:a9:6c (c8:1f:66:ea:a9:6c)
        .... ..0. .... .... .... .... = LG bit: Globally unique address (factory default)
        .... ...0 .... .... .... .... = IG bit: Individual address (unicast)
    Type: IP (0x0800)
Internet Protocol Version 4, Src: 192.168.25.2 (192.168.25.2), Dst: 52.50.205.41 (52.50.205.41)
    Version: 4
    Header length: 20 bytes
    Differentiated Services Field: 0x00 (DSCP 0x00: Default; ECN: 0x00: Not-ECT (Not ECN-Capable Transport))
        0000 00.. = Differentiated Services Codepoint: Default (0x00)
        .... ..00 = Explicit Congestion Notification: Not-ECT (Not ECN-Capable Transport) (0x00)
    Total Length: 520
    Identification: 0xd0f9 (53497)
    Flags: 0x00
        0... .... = Reserved bit: Not set
        .0.. .... = Don't fragment: Not set
        ..0. .... = More fragments: Not set
    Fragment offset: 0
    Time to live: 64
    Protocol: UDP (17)
    Header checksum: 0xcce5 [validation disabled]
        [Good: False]
        [Bad: False]
    Source: 192.168.25.2 (192.168.25.2)
    Destination: 52.50.205.41 (52.50.205.41)
User Datagram Protocol, Src Port: 5060 (5060), Dst Port: 5060 (5060)
    Source port: 5060 (5060)
    Destination port: 5060 (5060)
    Length: 500
    Checksum: 0xdd0b [validation disabled]
        [Good Checksum: False]
        [Bad Checksum: False]
Session Initiation Protocol (200)
    Status-Line: SIP/2.0 200 OK
        Status-Code: 200
        [Resent Packet: False]
        [Request Frame: 4677]
        [Response Time (ms): 1]
        [Release Time (ms): 1]
    Message Header
        Via: SIP/2.0/UDP 52.50.205.41:5060;branch=z9hG4bK4b8f.5f777c14.0;i=9;received=52.50.205.41
            Transport: UDP
            Sent-by Address: 52.50.205.41
            Sent-by port: 5060
            Branch: z9hG4bK4b8f.5f777c14.0
            i=9
            Received: 52.50.205.41
        From: <sip:1100@cequens.com;user=phone>;epid=5945353D84;tag=c0f7409094
            SIP from address: sip:1100@cequens.com;user=phone
                SIP from address User Part: 1100
                SIP from address Host Part: cequens.com
                SIP From URI parameter: user=phone
            SIP from tag: c0f7409094
        To: <sip:201006683021@sip.cequens.net;user=phone>;tag=as21be6ffa
            SIP to address: sip:201006683021@sip.cequens.net;user=phone
                SIP to address User Part: 201006683021
                SIP to address Host Part: sip.cequens.net
                SIP To URI parameter: user=phone
            SIP to tag: as21be6ffa
        Call-ID: 4df62d77-f7b2-4377-a8b6-abe614ab9c0f
        CSeq: 28538 BYE
            Sequence Number: 28538
            Method: BYE
        Server: Asterisk PBX GIT-master-95cf4f8
        Allow: INVITE, ACK, CANCEL, OPTIONS, BYE, REFER, SUBSCRIBE, NOTIFY, INFO, PUBLISH, MESSAGE
        Supported: replaces, timer
        Content-Length: 0

